<?xml version="1.0" encoding="UTF-8"?>

<machinesSetup xmlns="RunnerPyzza"
  xmlns:xsi="http://www.w3.org/2001/XMLSchema-instance"
  xsi:schemaLocation="RunnerPyzza MachinesSetup.xsd">
  <machine>
    <name>bazzilab</name>
    <hostname>150.217.45.168</hostname>
    <user>mgalardini</user>
  </machine>
  <machine>
    <name>galactus</name>
    <hostname>galactus-mobile</hostname>
    <user>galactus</user>
  </machine>
</machinesSetup>
